{"$id":"https://anki-study-report.local/schemas/learn-xp-candidate-protocol-v1.schema.json","$schema":"https://json-schema.org/draft/2020-12/schema","additionalProperties":false,"properties":{"$schema":{"const":"../schemas/learn-xp-candidate-protocol-v1.schema.json"},"amendment_policy":{"additionalProperties":false,"properties":{"required_disclosure":{"items":{"minLength":1,"type":"string"},"minItems":1,"type":"array","uniqueItems":true},"substantive_change_requires_new_version":{"const":true},"substantive_fields":{"items":{"minLength":1,"type":"string"},"minItems":1,"type":"array","uniqueItems":true},"typo_or_link_correction_may_keep_version":{"const":true}},"required":["typo_or_link_correction_may_keep_version","substantive_change_requires_new_version","substantive_fields","required_disclosure"],"type":"object"},"candidate_registry":{"items":{"additionalProperties":false,"properties":{"candidate_id":{"pattern":"^C-[A-Z0-9-]+$","type":"string"},"delay_policy_id":{"enum":["D1","D2"]},"family_id":{"enum":["F-CONFIRMATION-ONLY","F-PENDING-CONFIRMED-SPLIT"]},"lifecycle_model_version":{"const":1},"parameterization_id":{"enum":["P-CONFIRM-ONLY-D1","P-CONFIRM-ONLY-D2","P-SPLIT-D1","P-SPLIT-D2"]},"screening_outcome":{"type":"null"},"screening_status":{"type":"null"},"subject_strategy_id":{"enum":["S-CARD","S-NOTE-SIBLING"]},"survivor_selected":{"const":false}},"required":["candidate_id","family_id","parameterization_id","delay_policy_id","subject_strategy_id","lifecycle_model_version","screening_status","screening_outcome","survivor_selected"],"type":"object"},"maxItems":8,"minItems":8,"type":"array"},"candidate_statuses":{"additionalProperties":false,"properties":{"actual_candidate_statuses_assigned":{"const":false},"actual_family_outcomes_assigned":{"const":false},"allowed":{"const":["SCREENING_ELIGIBLE","SCREENING_NOT_ELIGIBLE","SCREENING_INCONCLUSIVE","REFERENCE_ONLY"]}},"required":["allowed","actual_candidate_statuses_assigned","actual_family_outcomes_assigned"],"type":"object"},"claims_boundary":{"additionalProperties":false,"properties":{"allowed":{"items":{"minLength":1,"type":"string"},"minItems":1,"type":"array","uniqueItems":true},"forbidden":{"items":{"minLength":1,"type":"string"},"minItems":1,"type":"array","uniqueItems":true}},"required":["allowed","forbidden"],"type":"object"},"delay_policies":{"items":{"additionalProperties":false,"properties":{"delay_policy_id":{"enum":["D1","D2"]},"displayed_interval_used":{"const":false},"expiry_anki_day_delta":{"minimum":1,"type":"integer"},"expiry_elapsed":{"minimum":1,"type":"integer"},"known_limitations":{"items":{"minLength":1,"type":"string"},"minItems":1,"type":"array"},"minimum_anki_day_delta":{"minimum":1,"type":"integer"},"minimum_elapsed":{"minimum":1,"type":"integer"},"monotonic_unit":{"const":"SYNTHETIC_MINUTE"},"rationale":{"minLength":1,"type":"string"},"same_chain_excluded":{"const":true},"scheduler_review_state_sufficient":{"const":false},"source_event_link_required":{"const":true},"title":{"minLength":1,"type":"string"}},"required":["delay_policy_id","title","monotonic_unit","minimum_elapsed","minimum_anki_day_delta","same_chain_excluded","source_event_link_required","scheduler_review_state_sufficient","displayed_interval_used","expiry_elapsed","expiry_anki_day_delta","rationale","known_limitations"],"type":"object"},"maxItems":2,"minItems":2,"type":"array"},"descriptive_metrics":{"items":{"additionalProperties":false,"properties":{"human_learning_truth":{"const":false},"metric_id":{"pattern":"^M-[A-Z0-9-]+$","type":"string"},"selection_role":{"enum":["DESCRIPTIVE","LEXICOGRAPHIC_MINIMIZE"]},"unit":{"enum":["LRU","LRU_MINUTES","RATIO","SYNTHETIC_MINUTES","COUNT"]}},"required":["metric_id","unit","selection_role","human_learning_truth"],"type":"object"},"maxItems":14,"minItems":14,"type":"array"},"expected_budget":{"additionalProperties":false,"properties":{"adaptive_units":{"const":0},"candidate_count":{"const":8},"expected_unique_unit_ids":{"const":340},"expected_units":{"const":340},"reference_variant_count":{"const":2},"scenario_condition_count_per_identity":{"const":34},"scenario_count":{"const":30}},"required":["candidate_count","reference_variant_count","scenario_count","scenario_condition_count_per_identity","expected_units","expected_unique_unit_ids","adaptive_units"],"type":"object"},"families":{"items":{"additionalProperties":false,"allOf":[{"if":{"properties":{"family_id":{"const":"F-CONFIRMATION-ONLY"}},"required":["family_id"]},"then":{"properties":{"confirmation_settlement_lru":{"const":1.0},"pending_share_lru":{"const":0.0}}}},{"if":{"properties":{"family_id":{"const":"F-PENDING-CONFIRMED-SPLIT"}},"required":["family_id"]},"then":{"properties":{"confirmation_settlement_lru":{"const":0.75},"pending_share_lru":{"const":0.25}}}}],"properties":{"classification":{"const":"RESEARCH_ONLY_PROSPECTIVE"},"confirmation_settlement_lru":{"maximum":1,"minimum":0,"type":"number"},"family_id":{"enum":["F-CONFIRMATION-ONLY","F-PENDING-CONFIRMED-SPLIT"]},"hypothesis_id":{"enum":["H-CONFIRMATION-ONLY-SAFETY","H-SPLIT-BOUNDED-IMMEDIACY"]},"known_risks":{"items":{"minLength":1,"type":"string"},"minItems":1,"type":"array"},"normalized_total_lru":{"const":1.0},"parameterization_ids":{"items":{"minLength":1,"type":"string"},"maxItems":2,"minItems":2,"type":"array","uniqueItems":true},"pending_share_lru":{"exclusiveMaximum":0.5,"minimum":0,"type":"number"},"rationale":{"minLength":1,"type":"string"},"title":{"minLength":1,"type":"string"}},"required":["family_id","title","pending_share_lru","confirmation_settlement_lru","normalized_total_lru","parameterization_ids","hypothesis_id","classification","rationale","known_risks"],"type":"object"},"maxItems":2,"minItems":2,"type":"array"},"family_survivor_policy":{"additionalProperties":false,"properties":{"exact_tie_outcome":{"const":"FAMILY_INCONCLUSIVE"},"forbidden_tiebreakers":{"items":{"minLength":1,"type":"string"},"minItems":1,"type":"array","uniqueItems":true},"hard_gate_failures_compensable":{"const":false},"lexicographic_metric_ids":{"items":{"pattern":"^M-[A-Z0-9-]+$","type":"string"},"minItems":1,"type":"array","uniqueItems":true},"maximum_survivors_per_family":{"const":1},"selection_rule":{"const":"UNIQUE_LEXICOGRAPHIC_MINIMUM_AFTER_ALL_HARD_GATES"},"weighted_score_allowed":{"const":false}},"required":["maximum_survivors_per_family","hard_gate_failures_compensable","weighted_score_allowed","selection_rule","lexicographic_metric_ids","exact_tie_outcome","forbidden_tiebreakers"],"type":"object"},"g2_4_handoff":{"additionalProperties":false,"properties":{"g2_4_started":{"const":false},"required_outputs":{"items":{"minLength":1,"type":"string"},"minItems":1,"type":"array","uniqueItems":true},"screening_results_exist":{"const":false},"stage":{"const":"G2.4"},"title":{"minLength":1,"type":"string"}},"required":["stage","title","required_outputs","screening_results_exist","g2_4_started"],"type":"object"},"hard_gates":{"items":{"additionalProperties":false,"properties":{"claim":{"minLength":1,"type":"string"},"failure_consequence":{"const":"SCREENING_NOT_ELIGIBLE"},"gate_id":{"pattern":"^GATE-[A-Z0-9-]+$","type":"string"},"invariant_ids":{"items":{"enum":["INV-SCHEDULER-UNCHANGED","INV-FSRS-UNCHANGED","INV-DUE-DATES-UNCHANGED","INV-BUTTON-DIRECT-REWARD-NEUTRAL","INV-HONEST-AGAIN-NOT-PUNISHED","INV-NO-HARD-MISREPORT-INCENTIVE","INV-NO-STEP-COUNT-GAIN","INV-NO-RESPONSE-TIME-REWARD","INV-SESSION-INVARIANT","INV-CONFIGURATION-INVARIANT","INV-RESET-DOES-NOT-MINT-NEW-ACHIEVEMENT","INV-DUPLICATE-OBJECTS-DO-NOT-MULTIPLY-ACHIEVEMENT","INV-PENDING-BOUNDED","INV-CONFIRMATION-REQUIRES-INDEPENDENT-SIGNAL","INV-DETERMINISTIC-REPLAY","INV-DECOMPOSABLE-EVIDENCE","INV-RESEARCH-ONLY","INV-NO-REAL-USER-DATA","INV-NO-PRODUCTION-APPROVAL"]},"minItems":1,"type":"array","uniqueItems":true},"missing_data_behavior":{"const":"FAIL_CLOSED"},"noncompensable":{"const":true},"weighted_score_allowed":{"const":false}},"required":["gate_id","claim","invariant_ids","failure_consequence","missing_data_behavior","noncompensable","weighted_score_allowed"],"type":"object"},"maxItems":23,"minItems":23,"type":"array"},"hypotheses":{"items":{"additionalProperties":false,"properties":{"claim":{"minLength":1,"type":"string"},"expected_direction":{"minLength":1,"type":"string"},"falsification":{"items":{"minLength":1,"type":"string"},"minItems":1,"type":"array"},"hypothesis_id":{"pattern":"^H-[A-Z0-9-]+$","type":"string"},"known_uncertainty":{"minLength":1,"type":"string"},"non_claim":{"minLength":1,"type":"string"},"required_cells":{"items":{"minLength":1,"type":"string"},"minItems":1,"type":"array","uniqueItems":true}},"required":["hypothesis_id","claim","expected_direction","non_claim","falsification","required_cells","known_uncertainty"],"type":"object"},"maxItems":5,"minItems":5,"type":"array"},"identity":{"additionalProperties":false,"properties":{"protocol_id":{"const":"learn-xp-candidate-protocol"},"version":{"const":1}},"required":["protocol_id","version"],"type":"object"},"matrix_axes":{"additionalProperties":false,"properties":{"adaptive_units_allowed":{"const":false},"candidate_or_reference_identity":{"items":{"minLength":1,"type":"string"},"maxItems":10,"minItems":10,"type":"array","uniqueItems":true},"configuration_profile":{"const":["CFG-ONE-STEP","CFG-THREE-STEP"]},"delay_policy":{"const":["D1","D2","D-NONE"]},"replica":{"const":[0]},"scenario":{"items":{"minLength":1,"type":"string"},"maxItems":30,"minItems":30,"type":"array","uniqueItems":true},"seed_axis":{"const":"ABSENT_DETERMINISTIC"},"session_time_arrangement":{"const":["TIME-CONTIGUOUS","TIME-SPLIT-DAY-CLOCK"]},"subject_strategy":{"const":["S-CARD","S-NOTE-SIBLING"]}},"required":["candidate_or_reference_identity","subject_strategy","delay_policy","scenario","configuration_profile","session_time_arrangement","replica","seed_axis","adaptive_units_allowed"],"type":"object"},"parameterizations":{"items":{"additionalProperties":false,"properties":{"confirmation_settlement_lru":{"maximum":1,"minimum":0,"type":"number"},"delay_policy_id":{"enum":["D1","D2"]},"family_id":{"enum":["F-CONFIRMATION-ONLY","F-PENDING-CONFIRMED-SPLIT"]},"normalized_total_lru":{"const":1.0},"parameterization_id":{"enum":["P-CONFIRM-ONLY-D1","P-CONFIRM-ONLY-D2","P-SPLIT-D1","P-SPLIT-D2"]},"pending_share_lru":{"exclusiveMaximum":0.5,"minimum":0,"type":"number"}},"required":["parameterization_id","family_id","delay_policy_id","pending_share_lru","confirmation_settlement_lru","normalized_total_lru"],"type":"object"},"maxItems":4,"minItems":4,"type":"array"},"production_flags":{"additionalProperties":false,"properties":{"candidate_families_selected":{"const":true},"candidate_outcome_selected":{"const":false},"candidate_protocol_defined":{"const":true},"confirmation_delays_selected":{"const":true},"family_survivor_selected":{"const":false},"final_model_selected":{"const":false},"g2_2_fixes_complete":{"const":true},"g2_4_started":{"const":false},"pending_ratio_selected_for_protocol":{"const":true},"production_approved":{"const":false},"production_integration":{"const":false},"reward_unit_normalized":{"const":true},"screening_executed":{"const":false},"screening_implemented":{"const":false},"screening_matrix_frozen":{"const":true},"subject_strategies_selected_for_comparison":{"const":true}},"required":["g2_2_fixes_complete","candidate_protocol_defined","candidate_families_selected","subject_strategies_selected_for_comparison","confirmation_delays_selected","pending_ratio_selected_for_protocol","reward_unit_normalized","screening_matrix_frozen","screening_implemented","screening_executed","candidate_outcome_selected","family_survivor_selected","final_model_selected","production_approved","production_integration","g2_4_started"],"type":"object"},"reference":{"additionalProperties":false,"properties":{"candidate":{"const":false},"reference_id":{"const":"L-NO-LEARN-XP"},"semantics":{"minLength":1,"type":"string"},"survivor_eligible":{"const":false},"variants":{"items":{"additionalProperties":false,"properties":{"candidate":{"const":false},"delay_policy_id":{"const":"D-NONE"},"reference_id":{"const":"L-NO-LEARN-XP"},"reference_variant_id":{"enum":["R-NO-LEARN-XP-CARD","R-NO-LEARN-XP-NOTE-SIBLING"]},"reward_allocation_lru":{"const":0.0},"status":{"const":"REFERENCE_ONLY"},"subject_strategy_id":{"enum":["S-CARD","S-NOTE-SIBLING"]},"survivor_eligible":{"const":false}},"required":["reference_variant_id","reference_id","subject_strategy_id","delay_policy_id","reward_allocation_lru","candidate","survivor_eligible","status"],"type":"object"},"maxItems":2,"minItems":2,"type":"array"}},"required":["reference_id","semantics","candidate","survivor_eligible","variants"],"type":"object"},"reward_unit":{"additionalProperties":false,"properties":{"comparative_research_only":{"const":true},"negative_allowed":{"const":false},"normalized_total_per_confirmed_achievement":{"const":1.0},"production_xp":{"const":false},"review_unit":{"const":false},"spendable":{"const":false},"title":{"minLength":1,"type":"string"},"total_above_one_allowed":{"const":false},"unit_id":{"const":"LRU"}},"required":["unit_id","title","normalized_total_per_confirmed_achievement","negative_allowed","total_above_one_allowed","production_xp","review_unit","spendable","comparative_research_only"],"type":"object"},"scenario_registry":{"items":{"additionalProperties":false,"properties":{"adaptive":{"const":false},"configuration_profiles":{"items":{"enum":["CFG-ONE-STEP","CFG-THREE-STEP"]},"maxItems":2,"minItems":1,"type":"array","uniqueItems":true},"scenario_id":{"minLength":1,"type":"string"},"scenario_kind":{"enum":["FROZEN_LIFECYCLE_FIXTURE","CANDIDATE_ACCOUNTING"]},"session_time_arrangements":{"items":{"enum":["TIME-CONTIGUOUS","TIME-SPLIT-DAY-CLOCK"]},"maxItems":2,"minItems":1,"type":"array","uniqueItems":true},"source_fixture_id":{"type":["string","null"]}},"required":["scenario_id","scenario_kind","source_fixture_id","configuration_profiles","session_time_arrangements","adaptive"],"type":"object"},"maxItems":30,"minItems":30,"type":"array"},"scope":{"additionalProperties":false,"properties":{"in_scope":{"items":{"minLength":1,"type":"string"},"minItems":1,"type":"array","uniqueItems":true},"out_of_scope":{"items":{"minLength":1,"type":"string"},"minItems":1,"type":"array","uniqueItems":true}},"required":["in_scope","out_of_scope"],"type":"object"},"source_contracts":{"additionalProperties":false,"properties":{"g2_1":{"additionalProperties":false,"properties":{"contract_blob_sha":{"pattern":"^[0-9a-f]{40}$","type":"string"},"contract_id":{"const":"learn-xp-problem-contract"},"required_status":{"const":"FROZEN_PRE_LIFECYCLE_ANALYSIS"},"schema_blob_sha":{"pattern":"^[0-9a-f]{40}$","type":"string"}},"required":["contract_id","required_status","contract_blob_sha","schema_blob_sha"],"type":"object"},"g2_2":{"additionalProperties":false,"properties":{"fixture_count":{"const":23},"fixture_manifest_blob_sha":{"pattern":"^[0-9a-f]{40}$","type":"string"},"fixture_manifest_digest":{"pattern":"^[0-9a-f]{64}$","type":"string"},"fixture_schema_blob_sha":{"pattern":"^[0-9a-f]{40}$","type":"string"},"invariant_count":{"const":19},"model_blob_sha":{"pattern":"^[0-9a-f]{40}$","type":"string"},"model_id":{"const":"learn-xp-lifecycle-model"},"model_schema_blob_sha":{"pattern":"^[0-9a-f]{40}$","type":"string"},"required_status":{"const":"FROZEN_PRE_CANDIDATE_DESIGN"},"threat_family_count":{"const":6}},"required":["model_id","required_status","model_blob_sha","model_schema_blob_sha","fixture_schema_blob_sha","fixture_manifest_blob_sha","fixture_manifest_digest","fixture_count","threat_family_count","invariant_count"],"type":"object"}},"required":["g2_1","g2_2"],"type":"object"},"status":{"additionalProperties":false,"properties":{"g2_status":{"const":"IN_PROGRESS"},"next_stage":{"const":"G2.4"},"next_stage_started":{"const":false},"protocol_status":{"const":"FROZEN_PRE_SCREENING_IMPLEMENTATION"},"stage":{"const":"G2.3"}},"required":["stage","g2_status","protocol_status","next_stage","next_stage_started"],"type":"object"},"subject_strategies":{"additionalProperties":false,"properties":{"note_sibling_relation":{"const":"OPERATIONALLY_EQUIVALENT"},"strategies":{"items":{"additionalProperties":false,"properties":{"conceptual_subject_ids":{"items":{"enum":["CARD","NOTE","SIBLING_GROUP"]},"maxItems":2,"minItems":1,"type":"array","uniqueItems":true},"continuity_key":{"enum":["synthetic_card_id","synthetic_note_id"]},"operational_relation":{"enum":["GRANULAR_COMPARISON","OPERATIONALLY_EQUIVALENT"]},"private_content_required":{"const":false},"rationale":{"minLength":1,"type":"string"},"subject_strategy_id":{"enum":["S-CARD","S-NOTE-SIBLING"]},"title":{"minLength":1,"type":"string"}},"required":["subject_strategy_id","title","conceptual_subject_ids","continuity_key","private_content_required","operational_relation","rationale"],"type":"object"},"maxItems":2,"minItems":2,"type":"array"},"strategy_count":{"const":2}},"required":["note_sibling_relation","strategy_count","strategies"],"type":"object"},"technical_fixes":{"additionalProperties":false,"properties":{"canonical_digest_consolidation":{"const":"SHARED_CANONICAL_JSON"},"direct_event_types":{"const":"EXACT_NO_COERCION"},"fix_commit_sha":{"const":"4d9b05f0347df85cb34ad85c1a935892ea7b4e4d"},"frozen_case_count":{"const":31},"frozen_result_drift":{"const":false},"legacy_shared_digest_parity":{"const":true},"manifest_digest_unchanged":{"const":true},"negative_coercion_tests":{"const":true}},"required":["fix_commit_sha","canonical_digest_consolidation","legacy_shared_digest_parity","frozen_case_count","frozen_result_drift","manifest_digest_unchanged","direct_event_types","negative_coercion_tests"],"type":"object"},"terminal_disposition":{"additionalProperties":false,"properties":{"CANCELLED":{"additionalProperties":false,"properties":{"fresh_eligibility":{"const":false},"provisional_becomes":{"const":"VOID"},"total_lru":{"const":0.0}},"required":["total_lru","provisional_becomes","fresh_eligibility"],"type":"object"},"CONFIRMED":{"additionalProperties":false,"properties":{"pending_settles_not_adds":{"const":true},"total_lru":{"const":1.0}},"required":["total_lru","pending_settles_not_adds"],"type":"object"},"EXPIRED":{"additionalProperties":false,"properties":{"fresh_eligibility":{"const":false},"provisional_becomes":{"const":"VOID"},"total_lru":{"const":0.0}},"required":["total_lru","provisional_becomes","fresh_eligibility"],"type":"object"},"INVALIDATED":{"additionalProperties":false,"properties":{"fresh_eligibility":{"const":false},"provisional_becomes":{"const":"VOID"},"total_lru":{"const":0.0}},"required":["total_lru","provisional_becomes","fresh_eligibility"],"type":"object"},"historical_pending_audit_may_remain":{"const":true},"negative_reward_allowed":{"const":false}},"required":["CONFIRMED","EXPIRED","CANCELLED","INVALIDATED","negative_reward_allowed","historical_pending_audit_may_remain"],"type":"object"},"unit_identity":{"additionalProperties":false,"properties":{"canonicalization":{"const":"canonical_json.canonical_digest"},"execution_order_or_path_included":{"const":false},"fields":{"items":{"minLength":1,"type":"string"},"maxItems":11,"minItems":11,"type":"array","uniqueItems":true},"seed_value":{"type":"null"},"unit_id_format":{"const":"U-<LOWERCASE_SHA256>"}},"required":["fields","canonicalization","unit_id_format","execution_order_or_path_included","seed_value"],"type":"object"}},"required":["$schema","identity","status","source_contracts","technical_fixes","scope","reward_unit","reference","families","parameterizations","subject_strategies","delay_policies","terminal_disposition","candidate_registry","hypotheses","hard_gates","descriptive_metrics","candidate_statuses","family_survivor_policy","matrix_axes","scenario_registry","unit_identity","expected_budget","amendment_policy","claims_boundary","g2_4_handoff","production_flags"],"type":"object"}
