{"$schema":"../schemas/learn-xp-candidate-protocol-v1.schema.json","amendment_policy":{"required_disclosure":["new version","field-level diff","rationale","results-viewed disclosure","prior-run invalidation","required rerun","roadmap note"],"substantive_change_requires_new_version":true,"substantive_fields":["family","amount or ratio","delay","subject strategy","gate or metric","matrix axis","unit identity","survivor rule","status","missing-data behavior"],"typo_or_link_correction_may_keep_version":true},"candidate_registry":[{"candidate_id":"C-CONFIRMATION-ONLY-D1-CARD","delay_policy_id":"D1","family_id":"F-CONFIRMATION-ONLY","lifecycle_model_version":1,"parameterization_id":"P-CONFIRM-ONLY-D1","screening_outcome":null,"screening_status":null,"subject_strategy_id":"S-CARD","survivor_selected":false},{"candidate_id":"C-CONFIRMATION-ONLY-D1-NOTE-SIBLING","delay_policy_id":"D1","family_id":"F-CONFIRMATION-ONLY","lifecycle_model_version":1,"parameterization_id":"P-CONFIRM-ONLY-D1","screening_outcome":null,"screening_status":null,"subject_strategy_id":"S-NOTE-SIBLING","survivor_selected":false},{"candidate_id":"C-CONFIRMATION-ONLY-D2-CARD","delay_policy_id":"D2","family_id":"F-CONFIRMATION-ONLY","lifecycle_model_version":1,"parameterization_id":"P-CONFIRM-ONLY-D2","screening_outcome":null,"screening_status":null,"subject_strategy_id":"S-CARD","survivor_selected":false},{"candidate_id":"C-CONFIRMATION-ONLY-D2-NOTE-SIBLING","delay_policy_id":"D2","family_id":"F-CONFIRMATION-ONLY","lifecycle_model_version":1,"parameterization_id":"P-CONFIRM-ONLY-D2","screening_outcome":null,"screening_status":null,"subject_strategy_id":"S-NOTE-SIBLING","survivor_selected":false},{"candidate_id":"C-PENDING-SPLIT-D1-CARD","delay_policy_id":"D1","family_id":"F-PENDING-CONFIRMED-SPLIT","lifecycle_model_version":1,"parameterization_id":"P-SPLIT-D1","screening_outcome":null,"screening_status":null,"subject_strategy_id":"S-CARD","survivor_selected":false},{"candidate_id":"C-PENDING-SPLIT-D1-NOTE-SIBLING","delay_policy_id":"D1","family_id":"F-PENDING-CONFIRMED-SPLIT","lifecycle_model_version":1,"parameterization_id":"P-SPLIT-D1","screening_outcome":null,"screening_status":null,"subject_strategy_id":"S-NOTE-SIBLING","survivor_selected":false},{"candidate_id":"C-PENDING-SPLIT-D2-CARD","delay_policy_id":"D2","family_id":"F-PENDING-CONFIRMED-SPLIT","lifecycle_model_version":1,"parameterization_id":"P-SPLIT-D2","screening_outcome":null,"screening_status":null,"subject_strategy_id":"S-CARD","survivor_selected":false},{"candidate_id":"C-PENDING-SPLIT-D2-NOTE-SIBLING","delay_policy_id":"D2","family_id":"F-PENDING-CONFIRMED-SPLIT","lifecycle_model_version":1,"parameterization_id":"P-SPLIT-D2","screening_outcome":null,"screening_status":null,"subject_strategy_id":"S-NOTE-SIBLING","survivor_selected":false}],"candidate_statuses":{"actual_candidate_statuses_assigned":false,"actual_family_outcomes_assigned":false,"allowed":["SCREENING_ELIGIBLE","SCREENING_NOT_ELIGIBLE","SCREENING_INCONCLUSIVE","REFERENCE_ONLY"]},"claims_boundary":{"allowed":["passes frozen synthetic lifecycle/accounting gates","resists listed synthetic farming traces","preserves research-only technical boundaries"],"forbidden":["user learned or mastered material","improves retention or motivation","prevents all gaming","production-ready","rating is objectively truthful"]},"delay_policies":[{"delay_policy_id":"D1","displayed_interval_used":false,"expiry_anki_day_delta":7,"expiry_elapsed":10080,"known_limitations":["Not claimed to be an optimal human-learning interval.","Anki-day rollover is necessary but not sufficient."],"minimum_anki_day_delta":1,"minimum_elapsed":1440,"monotonic_unit":"SYNTHETIC_MINUTE","rationale":"Earliest bounded cross-day contrast that cannot be satisfied by same-chain practice alone.","same_chain_excluded":true,"scheduler_review_state_sufficient":false,"source_event_link_required":true,"title":"24-hour next-Anki-day boundary"},{"delay_policy_id":"D2","displayed_interval_used":false,"expiry_anki_day_delta":14,"expiry_elapsed":20160,"known_limitations":["Not claimed to be an optimal human-learning interval.","Longer delay may increase unconfirmed pending exposure."],"minimum_anki_day_delta":3,"minimum_elapsed":4320,"monotonic_unit":"SYNTHETIC_MINUTE","rationale":"More conservative multi-day separation for a bounded prospective delay contrast.","same_chain_excluded":true,"scheduler_review_state_sufficient":false,"source_event_link_required":true,"title":"72-hour three-Anki-day boundary"}],"descriptive_metrics":[{"human_learning_truth":false,"metric_id":"M-PROVISIONAL-ALLOCATION","selection_role":"DESCRIPTIVE","unit":"LRU"},{"human_learning_truth":false,"metric_id":"M-CONFIRMED-ALLOCATION","selection_role":"DESCRIPTIVE","unit":"LRU"},{"human_learning_truth":false,"metric_id":"M-UNCONFIRMED-PROVISIONAL-EXPOSURE","selection_role":"LEXICOGRAPHIC_MINIMIZE","unit":"LRU_MINUTES"},{"human_learning_truth":false,"metric_id":"M-CONFIRMATION-RATE","selection_role":"DESCRIPTIVE","unit":"RATIO"},{"human_learning_truth":false,"metric_id":"M-TERMINAL-RATE","selection_role":"DESCRIPTIVE","unit":"RATIO"},{"human_learning_truth":false,"metric_id":"M-TIME-TO-CONFIRMATION","selection_role":"LEXICOGRAPHIC_MINIMIZE","unit":"SYNTHETIC_MINUTES"},{"human_learning_truth":false,"metric_id":"M-DUPLICATE-GAIN","selection_role":"LEXICOGRAPHIC_MINIMIZE","unit":"LRU"},{"human_learning_truth":false,"metric_id":"M-STEP-COUNT-GAIN","selection_role":"LEXICOGRAPHIC_MINIMIZE","unit":"LRU"},{"human_learning_truth":false,"metric_id":"M-RESET-REIMPORT-GAIN","selection_role":"LEXICOGRAPHIC_MINIMIZE","unit":"LRU"},{"human_learning_truth":false,"metric_id":"M-SESSION-CONFIG-GAIN","selection_role":"LEXICOGRAPHIC_MINIMIZE","unit":"LRU"},{"human_learning_truth":false,"metric_id":"M-SUBJECT-COLLISION-FRAGMENTATION","selection_role":"LEXICOGRAPHIC_MINIMIZE","unit":"COUNT"},{"human_learning_truth":false,"metric_id":"M-ACTIVE-PENDING-PEAK","selection_role":"LEXICOGRAPHIC_MINIMIZE","unit":"COUNT"},{"human_learning_truth":false,"metric_id":"M-INVALID-TERMINAL-RETAINED-LRU","selection_role":"LEXICOGRAPHIC_MINIMIZE","unit":"LRU"},{"human_learning_truth":false,"metric_id":"M-EXPLANATION-COMPLEXITY-FIELDS","selection_role":"LEXICOGRAPHIC_MINIMIZE","unit":"COUNT"}],"expected_budget":{"adaptive_units":0,"candidate_count":8,"expected_unique_unit_ids":340,"expected_units":340,"reference_variant_count":2,"scenario_condition_count_per_identity":34,"scenario_count":30},"families":[{"classification":"RESEARCH_ONLY_PROSPECTIVE","confirmation_settlement_lru":1.0,"family_id":"F-CONFIRMATION-ONLY","hypothesis_id":"H-CONFIRMATION-ONLY-SAFETY","known_risks":["Delayed feedback may reduce immediacy; this protocol does not claim a motivation effect."],"normalized_total_lru":1.0,"parameterization_ids":["P-CONFIRM-ONLY-D1","P-CONFIRM-ONLY-D2"],"pending_share_lru":0.0,"rationale":"No provisional allocation is exposed before an independent confirmation signal.","title":"Confirmation-only allocation"},{"classification":"RESEARCH_ONLY_PROSPECTIVE","confirmation_settlement_lru":0.75,"family_id":"F-PENDING-CONFIRMED-SPLIT","hypothesis_id":"H-SPLIT-BOUNDED-IMMEDIACY","known_risks":["Pending adds expiry, cancellation, invalidation, ambiguity and audit complexity."],"normalized_total_lru":1.0,"parameterization_ids":["P-SPLIT-D1","P-SPLIT-D2"],"pending_share_lru":0.25,"rationale":"A binary-exact quarter share provides a visible but minority provisional signal while three quarters remain behind independent confirmation.","title":"Pending/confirmed split allocation"}],"family_survivor_policy":{"exact_tie_outcome":"FAMILY_INCONCLUSIVE","forbidden_tiebreakers":["candidate name","registry order","single seed","aesthetics","post-hoc weighted score"],"hard_gate_failures_compensable":false,"lexicographic_metric_ids":["M-DUPLICATE-GAIN","M-STEP-COUNT-GAIN","M-RESET-REIMPORT-GAIN","M-SESSION-CONFIG-GAIN","M-INVALID-TERMINAL-RETAINED-LRU","M-SUBJECT-COLLISION-FRAGMENTATION","M-UNCONFIRMED-PROVISIONAL-EXPOSURE","M-ACTIVE-PENDING-PEAK","M-TIME-TO-CONFIRMATION","M-EXPLANATION-COMPLEXITY-FIELDS"],"maximum_survivors_per_family":1,"selection_rule":"UNIQUE_LEXICOGRAPHIC_MINIMUM_AFTER_ALL_HARD_GATES","weighted_score_allowed":false},"g2_4_handoff":{"g2_4_started":false,"required_outputs":["strict unit manifest","complete gate table","candidate and reference evidence","family outcome table","amendment disclosure"],"screening_results_exist":false,"stage":"G2.4","title":"Bounded Learn XP screening implementation"},"hard_gates":[{"claim":"Frozen G2.1 contract and schema remain valid.","failure_consequence":"SCREENING_NOT_ELIGIBLE","gate_id":"GATE-G2-1-CONTINUITY","invariant_ids":["INV-NO-PRODUCTION-APPROVAL"],"missing_data_behavior":"FAIL_CLOSED","noncompensable":true,"weighted_score_allowed":false},{"claim":"Frozen G2.2 model, schemas and fixture manifest remain valid.","failure_consequence":"SCREENING_NOT_ELIGIBLE","gate_id":"GATE-G2-2-CONTINUITY","invariant_ids":["INV-DECOMPOSABLE-EVIDENCE"],"missing_data_behavior":"FAIL_CLOSED","noncompensable":true,"weighted_score_allowed":false},{"claim":"All frozen lifecycle result digests remain unchanged.","failure_consequence":"SCREENING_NOT_ELIGIBLE","gate_id":"GATE-LIFECYCLE-DIGEST-PARITY","invariant_ids":["INV-DETERMINISTIC-REPLAY"],"missing_data_behavior":"FAIL_CLOSED","noncompensable":true,"weighted_score_allowed":false},{"claim":"Direct event inputs reject coercion and unregistered values.","failure_consequence":"SCREENING_NOT_ELIGIBLE","gate_id":"GATE-STRICT-EVENT-TYPES","invariant_ids":["INV-DECOMPOSABLE-EVIDENCE"],"missing_data_behavior":"FAIL_CLOSED","noncompensable":true,"weighted_score_allowed":false},{"claim":"Learning-step configuration cannot increase allocation.","failure_consequence":"SCREENING_NOT_ELIGIBLE","gate_id":"GATE-NO-STEP-COUNT-GAIN","invariant_ids":["INV-NO-STEP-COUNT-GAIN"],"missing_data_behavior":"FAIL_CLOSED","noncompensable":true,"weighted_score_allowed":false},{"claim":"Again/Good retry loops cannot